job_company,questions,answers,country,area
Data Science at Zalando was asked...,Find top K elements in a very large collection,No answer,Germany,Data Analyst
Data Science at Zalando was asked...,What cross validation is and how it works,No answer,Germany,Data Analyst
Data Science Lead at Zalando was asked...,"Codility questions asking you to join one table to another, or write a function in R.",No answer,Germany,Data Analyst
Data Scientist at HelloFresh was asked...,Why did you choose a random forest? Why not an OLS? Questions on features engineering. Questions on ML interpretability. Some questions on A/B testing and marketing (attribution models mainly),No answer,Germany,Data Analyst
Senior Data Analyst at trivago was asked...,Success metric for a new product,No answer,Germany,Data Analyst
Data Science at PwC was asked...,"Hatten Sie schon einmal eine schwierige Situation, die Sie zu bewältigen hatten?",No answer,Germany,Data Analyst
Data Scientist at trivago was asked...,How can you improve trivago's working?,No answer,Germany,Data Analyst
Data Analyst at Wayfair was asked...,What problems did you face in your projects and how did you solve them?,No answer,Germany,Data Analyst
Product Data Analyst at Contentful was asked...,Here is the KPI framework. How we could improve it?,No answer,Germany,Data Analyst
Data Analyst at Contentful was asked...,- Tell me about your former work experience - What systems/tools did you work with? - SQL challenge + team workshop + presentation of a case study,No answer,Germany,Data Analyst
Business and Data Analyst SCM at RELEX Solutions was asked...,Was motiviert dich?,No answer,Germany,Data Analyst
Data Analyst at Babbel was asked...,"On SQL, BI tools, my work experience and skills, cultural fit questions.",No answer,Germany,Data Analyst
Data Analyst at Babbel was asked...,"Questions on SQL, Tableau and BI tools skills, my experience. Cultural fit questions.",No answer,Germany,Data Analyst
Data Scientist at Delivery Hero was asked...,Describe the details of random forests. Describe the details of XGBoost. Which is faster to train?,No answer,Germany,Data Analyst
Senior Data Analyst at Artsy was asked...,Tell me about one of your technical project and work through the details and the decisions you made.,No answer,Germany,Data Analyst
Data Scientist at Mapp Digital was asked...,- When Cross validation won’t avoid overfitting?,No answer,Germany,Data Analyst
Data Scientist at Delivery Hero was asked...,Describe the details of random forests. Describe the details of XGBoost. Which is faster to train?,No answer,Germany,Data Analyst
Data Scientist at Amazon was asked...,when was the last time you analyzed a set of data and found meaningful insights?,No answer,Germany,Data Analyst
Data Analyst at Red Hat was asked...,1. What do you know about the company? 2. What tools have you worked with? 3. What was the most complicated project you have ever done?,No answer,Germany,Data Analyst
Junior Data Scientist at TeamViewer was asked...,"Python, SQL and machine learning questions. Also talked about my past experiences in this field.",No answer,Germany,Data Analyst
Junior Data Scientist at TeamViewer was asked...,How would you count ALL the trees in Berlin?,No answer,Germany,Data Analyst
Data Scientist at Homebell was asked...,How do you use clustering in text mining.,No answer,Germany,Data Analyst
Data Scientist at VB Business Group was asked...,"Bitte erläutern Sie die Methoden, die Sie in Ihrem Projekt angewendet haben.",No answer,Germany,Data Analyst
Junior Data Analyst at Goodgame Studios was asked...,I was given an example of a data analysis problem and asked to find potential explanations for an observed correlation.,No answer,Germany,Data Analyst
Senior Data Scientist at Home HT was asked...,Standard Fragen für eine Senior Rolle,No answer,Germany,Data Analyst
Data Engineer Data Analyst at Smartify IT Solutions was asked...,"Ich wurde im Bewerbungsprozess nach dem Geschlecht meines Partners gefragt sowie nach meinen Familienplänen. Habe mich beschwert und die Bewerbung zurückgezogen, der Geschäftsführer behauptet natürlich, dass sei nie passiert.",No answer,Germany,Data Analyst
Working Student Data Science at Regis24 was asked...,"Als Studentin, die noch keine Arbeitserfahrung hat, wurde ich am meisten über meine Praktikumstätigkeiten gefragt. Außerdem hatte ich eine Aufgabe und einige Fragen bezüglich meiner Erfahrung mit dem Thema Data Science.",No answer,Germany,Data Analyst
Data Scientist at Audatic was asked...,1. Finding permutation of the matrix with 3 levels of difficulty. 2. Finding the average of the nested list.,No answer,Germany,Data Analyst
Data Analyst at HolidayCheck Group was asked...,He asked my why I'd like to work at HolidayCheck and what are their values. I didn't really check them in advance which costed me somewhat.,No answer,Germany,Data Analyst
Data Scientist at HQ Revenue was asked...,-My internship related questions. -My thesis methodology and research related. -Data science and hospitality related questions. -Questions related to my analysis on company dataset. -Techniques to detect anomalies in future. -How one can forecast demand based on prices.,No answer,Germany,Data Analyst
Data Scientist at travel audience was asked...,Programming in python and pandas,No answer,Germany,Data Analyst
Senior Data Analyst at travel audience was asked...,What are the differences between logistic and linear regression?,No answer,Germany,Data Analyst
Data Scientist at Mediengruppe RTL was asked...,"Tell me about yourself...what projects have you done? why are you leaving your current job? will you relocate to Germany? what is your salary expectation? Apparently, I gave a bigger salary range than expected (I saw it here on Glassdoor)! so be careful :)",No answer,Germany,Data Analyst
Data Scientist at EDAG Group was asked...,Wie stellen Sie sich das Arbeiten bei BFFT vor?,No answer,Germany,Data Analyst
Data Scientist & Machine Learning Engineer at CompuGroup Medical was asked...,Q: How can you implement this? Q: How can ML help us in this case?,No answer,Germany,Data Analyst
Data Analyst at SHARE NOW was asked...,Write code snippet/function used in conjunction with a monte carlo simulation.,No answer,Germany,Data Analyst
Data Scientist at LeanIX was asked...,Wieso ist die ROC-AUC keine gute Metrik für Klassifikations Probleme mit unbalancierten Klassen.,No answer,Germany,Data Analyst
Data Scientist at Outfittery was asked...,What is precision/recall and which one would be better to optimise?,No answer,Germany,Data Analyst
Data Analyst at Scout24 was asked...,"- describe professional experience and past analytics work in more depth - tools, programming languages and frameworks used - explain why you are interested in the role and in working for Scout24 - share a professional challenge / work project and how you tackled it",No answer,Germany,Data Analyst
Data Scientist at Architrave was asked...,What type of tasks have you done?,No answer,Germany,Data Analyst
Senior Data Analyst at Clark (Germany) was asked...,"Pretty conventional, about past experience.",No answer,Germany,Data Analyst
Big Data Analyst at P3 Group was asked...,Warum möchten Sie Ihren aktuellen Job verlassen?,No answer,Germany,Data Analyst
Data Analyst at GetYourGuide was asked...,How would you rate yourself on a scale of 1 to 10?,No answer,Germany,Data Analyst
Senior Data Scientist at GetYourGuide was asked...,I received a take-home assignment.,No answer,Germany,Data Analyst
Data Analyst at PubNative was asked...,How you cope with stress?,No answer,Germany,Data Analyst
BI Data Analyst at Ecosia was asked...,Explain what KPI you would use to evaluate the success of a new feature on the website before its launch? How would you analyze if this new feature is viable or not?,No answer,Germany,Data Analyst
Data Scientist at Wooga was asked...,- Simple task that needs to be completed in Postgresql,No answer,Germany,Data Analyst
Data Scientist at Wooga was asked...,"HR questions: Standard HR questions. Case study: 2 python coding, 1 sql question. Team Lead interview: A lot of questions related to ML, company and statistics.",No answer,Germany,Data Analyst
Data Scientist/Data Engineer at Emma was asked...,"Imagine we both have sheeps, and that If I give you one of my sheeps you will have the double of the sheeps I have, and i you give me one of yours, we will have the same amount of sheeps. How many sheeps each of us owns.",No answer,Germany,Data Analyst
Data Analyst at Eurowings Digital was asked...,"Pretty conventional questions, nothing special.",No answer,Germany,Data Analyst
Data Scientist at inovex was asked...,Was erwarten Sie von einem Arbeitgeber?,No answer,Germany,Data Analyst
Data Scientist at inovex was asked...,Was ist für Sie einem idealen Job?,No answer,Germany,Data Analyst
Data Scientist at AUTO1 Group was asked...,Test to create a basic prediction model with price variations.,No answer,Germany,Data Analyst
Junior Data Scientist at Adjust was asked...,Create PostgreSQL instances and write a query,No answer,Germany,Data Analyst
Data Analyst at Allianz was asked...,"Very classical questions: Introduce yourself, what was your role in this project, how do you see yourself in 5 years",No answer,Germany,Data Analyst
Data Analyst at Westwing Home and Living was asked...,They will ask you to explain a long SQL query.,No answer,Germany,Data Analyst
Data Analyst at MYTOYS GROUP was asked...,Sie Beschreibung des Vorstellungsgesprächs.,No answer,Germany,Data Analyst
Data Scientist at Marley Spoon was asked...,- How do you measure accuracy etc.,No answer,Germany,Data Analyst
Senior Data Scientist at HelloFresh was asked...,build a text classifier for movies based on input text data,No answer,Germany,Data Analyst
Senior Data Scientist at BASF was asked...,Was haben Sie in den letzten zwei Jahren so gemacht?,No answer,Germany,Data Analyst
Senior Data Scientist at New Yorker was asked...,- Which distribution can be used to represent people standing in queue,No answer,Germany,Data Analyst
Senior Data Scientist at New Yorker was asked...,- What is pep8,No answer,Germany,Data Analyst
Data Scientist at Blue Yonder was asked...,F: Warum haben Sie sich für ein Studium in Deutschland entschieden?,No answer,Germany,Data Analyst
Data Analyst at Wayfair was asked...,You have the same deadline for two projects and it looks impossible to complete both in time. What do you do?,No answer,Germany,Data Analyst
Data Scientist at Mapp Digital was asked...,- When Label encoding and One hot encoding won't work?,No answer,Germany,Data Analyst
Data Scientist at PlusDental was asked...,Why are you leaving academia?,No answer,Germany,Data Analyst
Data Scientist at Blue Yonder was asked...,F: Warum haben Sie sich für ein Studium in Deutschland entschieden?,No answer,Germany,Data Analyst
Custom Data Analyst at Daimler was asked...,Do you know Python language ?,No answer,Germany,Data Analyst
Data Engineer/Data Scientist at Project A was asked...,Do you know what's a query plan?,No answer,Germany,Data Analyst
Data Scientist at ImmoScout24 was asked...,Explain precision and recall to a product manager,No answer,Germany,Data Analyst
Data Analyst at Wayfair was asked...,You have the same deadline for two projects and it looks impossible to complete both in time. What do you do?,No answer,Germany,Data Analyst
Data Analyst at Wayfair was asked...,How do you handle your own mistakes?,No answer,Germany,Data Analyst
Data Scientist at Wayfair was asked...,There a three main channels through which people visit their website. What could be possible reasons for the number of people who are using one specific channel to decrease?,No answer,Germany,Data Analyst
Data Scientist at Delivery Hero was asked...,some toy problem which requires understanding of bayes rule.,No answer,Germany,Data Analyst
Data Scientist at Capgemini Invent was asked...,"Elevator-Pitch: Sie treffen den Chef der Firma. Geben Sie kurz an, in welche Technologien seine Firma inverstieren/fokussieren sollte.",No answer,Germany,Data Analyst
Student Data Analyst at General Motors (GM) was asked...,Make a power calculator using recursion. then improve it.,No answer,Germany,Data Analyst
Data Scientist at AUTO1 Group was asked...,Test to create a basic prediction model with price variations.,No answer,Germany,Data Analyst
Consultant Data Scientist Analytics at Deloitte was asked...,Was ist Ihre Gehaltsvorstellung.,No answer,Germany,Data Analyst
Data Scientist at Henkel was asked...,Tell me about yourself and your previous work.,No answer,Germany,Data Analyst
Financial Data Analyst at Flaregames was asked...,Fragen über meine Projekte,No answer,Germany,Data Analyst
Data Analyst at Datapine was asked...,Where Do You See Yourself In 5 Years? CV questions,No answer,Germany,Data Analyst
Data Scientist at Minodes was asked...,To solve Rossman Kaggle competition,No answer,Germany,Data Analyst
Datenanalyst at HitFox Group was asked...,Warum möchten Sie bei einer Unternehmensgründung arbeiten?,No answer,Germany,Data Analyst
Data Analyst at SensoMotoric Instruments was asked...,mostly technical questions and some standards like: why are you interested in smi?,No answer,Germany,Data Analyst
Data Scientist at Packetwerk was asked...,Explain logistic regression.,No answer,Germany,Data Analyst
Data Analyst at OptioPay was asked...,what is standard deviation and variance ?,No answer,Germany,Data Analyst
Behavioural Data Scientist at HeidelbergCement was asked...,How can we fix the dashboard that has some issue? What motivates you to work for us?,No answer,Germany,Data Analyst
Data Scientist at Rapidminer was asked...,Tell me about how you would approach a given machine learning problem.,No answer,Germany,Data Analyst
Data Scientist at Munich Innovation Labs was asked...,"Quetions about previous experience, challenging work and code analysis.",No answer,Germany,Data Analyst
Data Science at Panda Insight UG was asked...,"1-warum braucht man noch Data Scientist , wenn Auto Machine Learning alle Modelle entwickeln kann?",No answer,Germany,Data Analyst
Junior Data Analyst at mytheresa.com was asked...,Mostly about my previous experience and task,No answer,Germany,Data Analyst
Data Scientist at Ratepay was asked...,What way do you prefer to study new things?,No answer,Germany,Data Analyst
Data Scientist at MOIA was asked...,Reasons for choosing MOIA Experience in data analysis Approaches to problem-solving Technical Skill-set,No answer,Germany,Data Analyst
Senior Data Scientist at AMPLEXOR was asked...,"What is CNN, RNN? Handling Noise in data? Handling Unstructured data?",No answer,Germany,Data Analyst
Data Scientist at FlixBus was asked...,What is your favourite machine learning algorithm and why?,No answer,Germany,Data Analyst
Data Scientist at AKKA Technologies was asked...,Warum wir? Stellen Sie sich bitte vor. Wie sind Ihre Programmierkenntnisse. Kein Test.,No answer,Germany,Data Analyst
Data Science Software Developer at KONUX was asked...,The conversations with the responsible people were quite spontaneous mixed with some standard questions asked during job interviews.,No answer,Germany,Data Analyst
Data Scientist at KONUX was asked...,Man kann diesen Teil der Maske leider nicht löschen. Mir fällt aber keine relevante Frage mehr ein. Das Gespräch ist kein Grund zur Sorge.,No answer,Germany,Data Analyst
Data Scientist at Stepstone was asked...,"Home Assignment Data Analysis related, it was an open task.",No answer,Germany,Data Analyst
Data Scientist at LeanIX was asked...,"Normal HR questions first, then for the technical interview they asked generic data science questions. The programming project was easy Python programming",No answer,Germany,Data Analyst
Data Scientist at AGT International was asked...,"telephony - General Statistical Questions. Next round was about python, SQL and ML exercises",No answer,Germany,Data Analyst
Senior Data Scientist at AGT International was asked...,"They asked me to prepare a presentation of what I've done in my research and previous jobs. The questions were all about my own work. No classical interview questions, problem solving or quiz.",No answer,Germany,Data Analyst
Data Scientist at Outfittery was asked...,Task: write down (in pseudo code) a program that finds all pairs of integers between int a and int b which in sum give int c.,No answer,Germany,Data Analyst
Data Scientist at Outfittery was asked...,Somebody asks you for advice when it comes to a classification problem. A 80% classification accuracy was found. What do you think about that? Is it good / bad? What advice would you give?,No answer,Germany,Data Analyst
Junior Data Scientist at Annalect was asked...,general behavior Questions. Why do you choose us? What do you know about Annalect?,No answer,Germany,Data Analyst
Junior Data Scientist at KPMG was asked...,Warum ist der Job des Beraters passend für Sie?,No answer,Germany,Data Analyst
Data Scientist at EY was asked...,- Nähere Erklärung früher durchgeführter Projekte - Kenntnisse verschiedener Softwaretools,No answer,Germany,Data Analyst
Data Analyst at Rosen was asked...,über sich vorstellen Präsentieren Sie die bestehenden Daten Qualifikation,No answer,Germany,Data Analyst
Data Scientist at Searchmetrics was asked...,"- General questions about machine learning algorithms and models - This is an important one: How do you evaluate a model after training? Accuracy, precision, recall and F-measure - What can go wrong when training a classifier? Skewed samples, overfitting etc. - Can you use a random forest classifier to perform regression? - Explain how SVMs work - Software development tools (Git etc.) - Explain clustering by elaborating any one clustering algorithms (e.g. K-means)",No answer,Germany,Data Analyst
Data Analyst at Huawei Technologies was asked...,"do you know MySQL or SQL , are you familiar with it? do you know Tableaux and Power Bi? do you think you can learn how to use this tool in two weeks?",No answer,Germany,Data Analyst
Data Analyst at PubNative was asked...,How you manage multi-tasking?,No answer,Germany,Data Analyst
Data Analyst at PubNative was asked...,What analytics tools am I familiar with ?,No answer,Germany,Data Analyst
BI Data Analyst at Ecosia was asked...,"According to you which KPIs are necessary for a particular department (Marketing, sales)?",No answer,Germany,Data Analyst
Data Scientist/Data Engineer at Emma was asked...,Tell us about a negative feedback that you received.,No answer,Germany,Data Analyst
Data Scientist at GetYourGuide was asked...,"In the technical interviews, the data science questions were pretty standard, also no other advanced technical questions, neither about data science, machine learning nor engineering. Instead, there is a basic coding and math challenge via codility. The focus is clearly on the analytical and communication part, the main task in the remote technical interview was to analyse a chart and derive actions from the observations. Same for the non-technical interviews, mostly standard questions, but with a strong focus on providing examples from past projects, e.g. difficult situations, and how you handled them. Also a very strong focus on how you handled interactions with customers (both internal and external), being able to argue with metrics about success in past projects is absolutely required.",No answer,Germany,Data Analyst
Data Analyst at PubNative was asked...,What analytics tools am I familiar with ?,No answer,Germany,Data Analyst
Data Analyst at PubNative was asked...,How you manage multi-tasking?,No answer,Germany,Data Analyst
Data Analyst at Wooga was asked...,What do you know about Wooga? Did you play our games? (mostly expected and common questions to know you better in the initial interview),No answer,Germany,Data Analyst
BI Data Analyst at Ecosia was asked...,"According to you which KPIs are necessary for a particular department (Marketing, sales)?",No answer,Germany,Data Analyst
Data Scientist at Freeletics was asked...,Warum Freeletics?,No answer,Germany,Data Analyst
Data Scientist/Data Engineer at Emma was asked...,Tell us about a negative feedback that you received.,No answer,Germany,Data Analyst
Junior Data Scientist at AutoScout24 was asked...,Questions about my Take home assignment and machine learning workflow.,No answer,Germany,Data Analyst
Data Analyst/Data Scientist at AutoScout24 was asked...,Production level data science evaluation questions and scenarios.,No answer,Germany,Data Analyst
Data Analyst Intern at Zalando was asked...,Introduce a project you have done.,No answer,Germany,Data Analyst
Data Analyst at Zalando was asked...,Tell me about your past projects,No answer,Germany,Data Analyst
Data Analyst/Data Scientist at AutoScout24 was asked...,Production level data science evaluation questions and scenarios.,No answer,Germany,Data Analyst
Junior Data Scientist at AutoScout24 was asked...,Questions about my Take home assignment and machine learning workflow.,No answer,Germany,Data Analyst
Data Analyst at Wooga was asked...,What do you know about Wooga? Did you play our games? (mostly expected and common questions to know you better in the initial interview),No answer,Germany,Data Analyst
Data Scientist at IBM was asked...,Eine negative Erfahrung und wie diese gelöst wurde,No answer,Germany,Data Analyst
Duales Studium Data Scientist at SAS Institute was asked...,"Welche Programmierskills? Beschreiben Sie eine Situation, in der Sie einen Gruppenkonflikt auflösen konnten. Mit welchen 3 Attributen würde man Sie beschreiben? Was haben Sie in Ihrem Studium mitgenommen?",No answer,Germany,Data Analyst
Data Analyst at HelloFresh was asked...,How you can handle multiple requests in the same time?,No answer,Germany,Data Analyst
Senior Data Scientist at CHECK24 was asked...,"Die Herausforderung bestand im Lösen einer Aufgabe. Wie gehen sie vor ? (Konzept, Erklärung) Wie setzen sie dies um ? Welche Alternativen kennen sie ?",No answer,Germany,Data Analyst
Data Scientist at AXA was asked...,Wieso haben sie den gewaehlten Analyseansatz verwendet (Rueckfrage zur Aufgabe) ?,No answer,Germany,Data Analyst
Data Scientist at SAP was asked...,Techniques for handling missing data. Evaluation metrics for different uses cases (regression? RSME? also classification problem?) How to deal with unbalance dataset,No answer,Germany,Data Analyst
Data Scientist at SAP was asked...,"Wie würden Sie gegebene Daten visualisieren (mit Präsentation)? Wieviel Gehalt erwarten Sie? Wann können Sie anfangen? Warum glauben Sie, dass Sie bei einem weltklasse Unternehmen wie SAP einsteigen können?",No answer,Germany,Data Analyst
Data Scientist at E.ON was asked...,Could you present the last problem where you drew advantage from machine learning techniques?,No answer,Germany,Data Analyst
Data Scientist at AXA was asked...,Wieso haben sie den gewaehlten Analyseansatz verwendet (Rueckfrage zur Aufgabe) ?,No answer,Germany,Data Analyst
Junior Data Scientist at SAP was asked...,What do you think might happen in the next 5-10 years in the context of AI in society and /or business.,No answer,Germany,Data Analyst
Senior Data Scientist at BASF was asked...,They asked about how I earn my salary as a self-employed data scientist. I was also asked if I knew calibration design and how would I approach the analysis of crop harvesting time.,No answer,Germany,Data Analyst
Senior Data Scientist at BASF was asked...,Können Sie R?,No answer,Germany,Data Analyst
Senior Data Scientist at BASF was asked...,"Kennen Sie Cloud Umgebung, haben Sie damit gearbeitet?",No answer,Germany,Data Analyst
data science workin at Allianz was asked...,What are the topics that you would like to purse in the field of Machine Learning?,No answer,Germany,Data Analyst
Data Scientist at PwC was asked...,Technische Fragen zu verwendeten Methoden,No answer,Germany,Data Analyst
Data Scientist at trivago was asked...,Why do I want to change my job.,No answer,Germany,Data Analyst
Data Scientist at trivago was asked...,Why do I want to change my job.,No answer,Germany,Data Analyst
Data Scientist at Blue Yonder was asked...,F: Gehaltsvorstellung,No answer,Germany,Data Analyst
Data Scientist at Blue Yonder was asked...,F: Beziehung mit Kollegen in derzeitige Firma.,No answer,Germany,Data Analyst
Data Scientist at Vodafone was asked...,Several short statistics case studies (and little background on communication networks),No answer,Germany,Data Analyst
Data Analyst at Babbel was asked...,"On SQL, BI tools, my experience and tools, cultural fit questions.",No answer,Germany,Data Analyst
Data Scientist Working Student at Stryber was asked...,- How do you preprocess raw data ? - What steps do you follow to handle missing data points?,No answer,Germany,Data Analyst
Teamlead Data Science at Telefónica was asked...,"Nennen Sie 3 Stärken und 3 Schwächen (für eine solche Position doch sehr überraschende Frage, die stellt man eher New-Hires oder Praktikanten)",No answer,Germany,Data Analyst
Data Scientist at Delivery Hero was asked...,they asked about my last experience and skills they asked me to talk in details about one of my projects also they asked about my motivations and during the technical interviews there were live coding sessions besides to design and modeling questions,No answer,Germany,Data Analyst
(Senior) Game Data Scientist at Kolibri Games was asked...,Why do you want to join Kolibri?,No answer,Germany,Data Analyst
Data Analyst at Lingoda was asked...,"Previous experience in details, what exact responsibilities I had, what softwares I used, stakeholder mgmt.",No answer,Germany,Data Analyst
Data Scientist at Morressier was asked...,What do my current colleagues think about me.,No answer,Germany,Data Analyst
