job_company,questions,answers,country,area
User Experience UI Designer at HelloFresh was asked...,How would you design a new feature or redesign an existing feature for our current mobile app?,No answer,Germany,UX/UI Designer
UI-UX Designer at HelloFresh was asked...,Why do you want to work for Hello Fresh?,No answer,Germany,UX/UI Designer
UI/UX Designer at Global Savings Group was asked...,What was the most interesting project in your work experience?,No answer,Germany,UX/UI Designer
Junior UI Designer at Gymondo was asked...,Tell me more about your experience?,No answer,Germany,UX/UI Designer
UI/UX Designer at Robert Bosch was asked...,Atomic Design? Aktuelle und vergangene Projekte? Tools?,No answer,Germany,UX/UI Designer
UI Designer at Kolibri Games was asked...,How many hours do you spend for gaming?,No answer,Germany,UX/UI Designer
Junior UI Designer at Gymondo was asked...,Tell me more about your experience?,No answer,Germany,UX/UI Designer
UI Designer at Quandoo was asked...,"Design Process, tools used",No answer,Germany,UX/UI Designer
UI-UX Designer at DB Schenker was asked...,- Can you introduce yourself? - How would you design this website? - What kind of residence do you have?,No answer,Germany,UX/UI Designer
UI-UX Designer at ShareTheMeal was asked...,"Questions were more related to my design desitions and workflow (methodologies, interface with developers, etc)",No answer,Germany,UX/UI Designer
UI Designer at Goodgame Studios was asked...,Design UI for 5 new features.,No answer,Germany,UX/UI Designer
UI/User Experience Designer at Mine Safety Appliances was asked...,how do you fill working with all men,No answer,Germany,UX/UI Designer
UI Designer at Wunder Mobility was asked...,What is your strenth of designing.,No answer,Germany,UX/UI Designer
UI Designer at Mobimeo was asked...,Recent project,No answer,Germany,UX/UI Designer
Junior UI Designer at Gymondo was asked...,Have you already tried the Gymondo app?,No answer,Germany,UX/UI Designer
UI-UX Designer at Gymondo was asked...,What's your role in your current team?,No answer,Germany,UX/UI Designer
UI-UX Designer at Gymondo was asked...,What's your role in your current team?,No answer,Germany,UX/UI Designer
UI-UX Designer at Wunderflats was asked...,What is your design process and how do you solve design problems?,No answer,Germany,UX/UI Designer
UI Designer at Quandoo was asked...,A few simple questions,No answer,Germany,UX/UI Designer
UI Designer at Kolibri Games was asked...,Superficial Questions about CV,No answer,Germany,UX/UI Designer
Web Developer at NavVis was asked...,This greatly depends on which role you are interviewing for,Mechanical engineering,Germany,Web Developer
Front End Web Developer at Eurowings Digital was asked...,Coding challenge was to integrate the Imgur API and create a view of all the images in a thumbnail displaying few metadata fields of each image/video. Another view was to display the original image/video with all the metadata relevant to it.,"I created the application in Angular 8, along with RxJS, HTML5, CSS and BEM pattern. Implemented few other concepts like Angular Routing and Proxying API calls. Also, i published the application on GitHub pages",Germany,Web Developer
Web Developer at payever was asked...,They will provide you a task and then judge you on basis of that,"Their task setup was incomplete, very poorly configured. their demo project functionality was broken",Germany,Web Developer
Web Developer at smava was asked...,Q: Experience with React? Q: Experience with scss/less/css? Q: Expereinece with javaScript?,A: List of previous jobs with related tech.,Germany,Web Developer
Frontend Web Developer at Delivery Hero was asked...,Js tasks,"4/5, make some errors",Germany,Web Developer
Senior Java Web Developer at Enmacc was asked...,What quality makes you unique in your current job?,being perfect at troubleshooting,Germany,Web Developer
Web Developer at Les Lunes was asked...,Introductory questions and behavioural questions,What they wanted to hear:),Germany,Web Developer
Part-Time Web Developer at Kolibri Games was asked...,Why did you leave your previous job?,I explained why I quit and what had bothered me.,Germany,Web Developer
Web Developer at HolidayPirates was asked...,Send me code samples.,gitHub profile,Germany,Web Developer
Web Developer at Commerz Systems was asked...,knowledge about HTML5,Answer each questions.,Germany,Web Developer
Junior Web Developer at Mediaman was asked...,Wie sind Sie auf uns gekommen?,,Germany,Web Developer
Senior Java Web Developer at Enmacc was asked...,What is three most important thing in a team?,"Friendliness, collaboration, mutual respect",Germany,Web Developer
Web Developer at CHECK24 was asked...,What are my skills,Told all my skills,Germany,Web Developer
Part-Time Web Developer at Kolibri Games was asked...,Why did you apply to Kolibri Games? How did you hear of the company?,"For me, it was purely accidental, so I explained that.",Germany,Web Developer
Web Developer at HolidayPirates was asked...,Giant coding task!!,source code for the solution,Germany,Web Developer
Front End Web Developer at IBM was asked...,What was the most surprising thing you got to know about JavaScript?,What did the 4 hours coding challenge include??,Germany,Web Developer
Web Developer at Acrontum was asked...,Ranged on all sorts of tech to personality questions,"Depended on the question but overall did quite well, they were looking for more fundamentals on coding than putting me under the spot light with trick questions.",Germany,Web Developer
Full Stack Web Developer at FlixBus was asked...,Why do you apply to this position?,Industry interest,Germany,Web Developer
Full Stack Web Developer at FlixBus was asked...,Salary expectations,50-55k,Germany,Web Developer
Frontend Web Developer at interactive tools was asked...,"Typische Fragen nach bekannten Frameworks, ein paar Quizz- und Testfragen, keine Fangfragen.",entsprechend meiner Erfahrung im Beruf,Germany,Web Developer
Web Developer at Travian Games was asked...,Tell us about your prior experience.,I explained what I've been working on.,Germany,Web Developer
Web Developer at X-Team was asked...,"This is a LITERAL cute and paste from their email, Generic basic stuff: === 1. How many years of experience do you have as a developer and with which languages/frameworks/etc.? 2. Do you have any links to a portfolio, Github or LinkedIn I can check out? 3. What's your availability like right now? If you're employed and would need to give a notice, how long would that take? What timezone are you in and what time of day do you work? And now for the more in-depth questions. Ready? Let's do this... Debugging How do you approach a tricky bug? Have any favorite tools or techniques for figuring things out when they go wrong? (max 300 words. Where helpful, include a few screenshots or a short video). Testing Can you tell us about a project where you have written tests and whether they were successful or not in increasing the quality of the code? If possible, show an example (pseudocode is fine) of how you rewrote some code to make it more testable. (max 300 words) Best Practices Describe something that is considered a ""best practice"" for a technology you're familiar with, and what factors go into your decision of whether to follow it or not.","Generic stuff,..., anyone who has coded for any significant amount of time knows how to debug, or clean up code or whatever",Germany,Web Developer
Web Developer at One Week Experience was asked...,"Interview related cv, previous experience",No answer,Germany,Web Developer
Web Developer at Gingco.net was asked...,Können Sie die FE Aufgaben so gut wie die BE Aufgaben übernehmen?,No answer,Germany,Web Developer
Senior Web Developer at Pepper was asked...,What are the key features of PHP7 and why are they useful / important?,No answer,Germany,Web Developer
Senior Web Developer at Pepper was asked...,"How do indices work, how to correcly create an index for several fields?",No answer,Germany,Web Developer
Web Developer at EMBL was asked...,"Simple questions about Linux, Ajax, PHP, etc.",No answer,Germany,Web Developer
FullStack Web Applications Developer at inovex was asked...,Warum möchten Sie als Fullstack Entwickler Arbeiten? (Im Gegensatz zu Frontend oder Backend),No answer,Germany,Web Developer
UI Web Developer at KAYAK was asked...,White board questions and coding exercises on a shared screen.,No answer,Germany,Web Developer
Web Developer at LIGADIGITAL was asked...,Wie sind Sie auf uns aufmerksam geworden?,No answer,Germany,Web Developer
Web Developer at navabi was asked...,"Übliche Fragen: Warum genau dieser Arbeitgeber, warum Aachen, etc",No answer,Germany,Web Developer
PHP Web Developer at Sociomantic Labs was asked...,Which kind of company are you looking for?,No answer,Germany,Web Developer
Web Developer at store2be was asked...,Implementiere eine Basisversion von einem angegebenen Stück Funktionalität der aktuellen Webseite in einer Programmiersprache deiner Wahl.,No answer,Germany,Web Developer
Full Stack Web Developer at Wirecard was asked...,Basic core Java questions,No answer,Germany,Web Developer
Master - GUI/Web-design for User Software at Blickfeld was asked...,"the recruiter asked me to work for free Hello Kesab, Thank you very much for your application and the interest in our company. Since you have applied for a Thesis, IDP or Student Project position, I wanted to ask what you are specifically looking for. We would like to inform you that it is not possible to work remotely, since you will be working closely together with your team. Furthermore we would like to let you know that unfortunately, as a start-up company, we are not able to offer paid theses. Students will receive internal benefits like a daily lunch allowance, free beverages, company events and more. We are looking forward to your application. Best regards, Ms. Felizitas Mayer Dual Student HR +49 89 230693500 ⟋ career@blickfeld.com Blickfeld GmbH /  www.blickfeld.com Barthstr. 12 / 80339 München Geschäftsführer: Dr. Mathias Müller, Terje Növig / Sitz der Gesellschaft: München HRB-Nr. 231953 / USt-IdNr. DE311443043",No answer,Germany,Web Developer
Web Developer at Arabesque was asked...,"Questions regarding different Angular concepts, as well as questions regarding testing, security, optimization and best coding practices in Angular.",No answer,Germany,Web Developer
Java Web Developer at camLine was asked...,Can you Introduce yourself ?,No answer,Germany,Web Developer
Senior Web Developer at AMBOSS was asked...,"Project review: reasons for choosing X technology, questions regarding approach to project, etc",No answer,Germany,Web Developer
Senior Web Developer at AMBOSS was asked...,"HR call: CV review, salary expectations, reason to move, general HR questions..",No answer,Germany,Web Developer
Front End Web Developer at InFarm was asked...,I was asked how the program which was programmed during the interview could be scaled to handle potentially thousands of requests,No answer,Germany,Web Developer
Senior Full-Stack Web Developer at Ubisoft was asked...,"The regular interview questions about C# and JS, ranging from junior to expert levels.",No answer,Germany,Web Developer
Web Developer at Akelius was asked...,What is RestfulAPI? How do you update a table? How do you get every other number in a string in JavaScript,No answer,Germany,Web Developer
Web Developer at Digital Master was asked...,Mit welchen Betriebssystemen habe Sie gearbeitet?,No answer,Germany,Web Developer
Web Developer at IT2Media was asked...,Erste Frage war über Gehalt.,No answer,Germany,Web Developer
Senior Web Developer at AMBOSS was asked...,"CTO call: CV review, tech stack, interest in company",No answer,Germany,Web Developer
Web Developer at CHECK24 was asked...,"- programming principles - programming patterns - mysql knowledge (explain, joins, unions) - salary expectation",No answer,Germany,Web Developer
Web Developer at Contentful was asked...,Most of the questions were focused on the company fit. The technical part was nice and relaxed,No answer,Germany,Web Developer
Senior Web Developer at Blinkist was asked...,How to center an element with CSS?,No answer,Germany,Web Developer
Full Stack Web Developer at Wirecard was asked...,Some programming puzzles,No answer,Germany,Web Developer
Web Developer at EXXETA was asked...,"Thema der Bachelorarbeit, Technische Fragen, Hobbies",No answer,Germany,Web Developer
Senior Web Developer at Pepper was asked...,What's your favorite (and less favorite) design pattern? Give a real example of using it.,No answer,Germany,Web Developer
Senior Web Developer at Pepper was asked...,What are the possible problems with pagination using limit/offset in MySQL?,No answer,Germany,Web Developer
Web Developer at EQS Group was asked...,"JS error types, differences between Observable and Promises",No answer,Germany,Web Developer
Senior Web Developer at AMBOSS was asked...,"PM call: CV review, general working questions, team-work questions",No answer,Germany,Web Developer
Frontend Web Developer at CHECK24 was asked...,Weird css questions that no one really cares about.,No answer,Germany,Web Developer
Senior Web Developer at Blinkist was asked...,What happens when you put a URL in the address bar of a browser and hit enter?,No answer,Germany,Web Developer
Junior Web Developer at TREMCO ILLBRUCK was asked...,Welche aufgaben habe ich im letzte Firma gemacht? Meine Stärke und Schwäche und ein paar Szenario-Fragen und technische Fragen.,No answer,Germany,Web Developer
Web Developer at GLOSSYBOX was asked...,I thankfully didn't encounter any artificial interview questions.,No answer,Germany,Web Developer
Web Developer at Nemetschek was asked...,Wie viele bilder kann gleichzeitig runter geladen?,No answer,Germany,Web Developer
Web Developer at TenMedia was asked...,Mainly presentation of old projects,No answer,Germany,Web Developer
Web Developer at Onefootball was asked...,"My skills towards technology, my past experience, application related few questions",I answered properly and I am confident those were correct.,Germany,Web Developer
Senior Web Developer at Pepper was asked...,"What SOLID stands for, how would you describe it in your own words?",No answer,Germany,Web Developer
Full Stack Web Developer at innoscripta was asked...,one of the algorithmic problems was related to queuing theory.,No answer,Germany,Web Developer
Senior Web Developer at Zalando was asked...,Why do I want to work for them?,No answer,Germany,Web Developer
Web Developer at Westwing Home and Living was asked...,How many squares on a chess board?,No answer,Germany,Web Developer
Part-Time Web Developer at Kolibri Games was asked...,What makes a good team / a good working experience?,No answer,Germany,Web Developer
Data Scientist at Kreditech Holding was asked...,Present a previous project and they will ask a lot of technical questions regarding the topic.,"Hello, can you give the details of the task that was given in the test.",Germany,Data Analyst
Data Analyst at Zalando was asked...,"- SQL: they use PostgreSQL, asked something related to join, rank, group by, index - Logistic related domain knowledge which is not my strength - Behavioral questions",be nice and have a nice conversation with them is important,Germany,Data Analyst
Data Analyst at Zalando was asked...,Why do you want to join zalando?,I did not,Germany,Data Analyst
Research Engineer/Data Science at Zalando was asked...,"Mostly technical / coding questions with limited time to answer, talk about past projects (with techncial depth), almost no questions with respect to data science (statistics, ml, math, modeling ...)",Could you provide some examples of the coding tests?,Germany,Data Analyst
Senior Data Analyst at Chrono24 was asked...,Warum will ich meinen derzeitigen Arbeitgeber verlassen.,Meine Situation geschildert,Germany,Data Analyst
Data Scientist at Lufthansa Industry Solutions was asked...,"Q1) Are you ready to travel? Q2) Projects are 6-9 months, are you interested in this? Q3) Do you know Java? Q4) We offer initially 2 year contracts?",A1) yes. A2) yes. What kind of project or any examples? She was void or said this is too technical for her. A3) yes but also there are more modern A-Z. The position I applied also doesn't mention Java? How is that? She was void and said this is to technical for her. A4) why not permanent contracts? She said this is Lufthansa methodology applied to all at the beginning.,Germany,Data Analyst
Junior Data Scientist at Actori was asked...,Introductory questions. Describing yourself. Your skills. Your past experiences. Presentation of a Case Study that was provided a few days before the interview.,I answered honestly. I sounded genuine and friendly. Smiling all the time. Presented the Case Study and answered the questions that followed.,Germany,Data Analyst
Data Scientist at vertical cloud solution was asked...,"HR Interview: Talk about the role, Do I have knowledge of algos like- LR, DT, RF etc.",Talked about my key responsibilities and my professional experiences,Germany,Data Analyst
Data Analyst at Monoqi was asked...,What is the standard deviation?,"I started giving them an explanation of what the standard deviation is, but I was cut off and told that they wanted the formula. I told them I don't know the formula off the top off my head to which they replied it is 1 over the sample size minus 1. That, to my knowledge, is not the standard formula for the standard deviation...",Germany,Data Analyst
Data Scientist at Teraki was asked...,"print numbers which contain digit ""5"" in them, in an specific range.","in Python, if you convert an int to an string, you can simply search a character ""5"" in it.",Germany,Data Analyst
Data Analyst at About You was asked...,How do you do funnels in BigQuery? What's the workflow to automate dashboards? How do you save money on queries of BigQuery?,"They sent me an automatic response saying that I was rejected from the interview process, without any clarification, nor respect for the time and effort I invested. I asked for a feedback due to I invested 3 days of my personal time to work on the case and presentation. Never recieved a reply, nor what could I have done better. A waste of time, a total abuse. Very frustrating, and infuriating. DO not waste your time with this peoplea.",Germany,Data Analyst
BI Data Analyst at Ecosia was asked...,Explain ideal KPI's for different different scenarios they will put up.,you must have experience or knowledge with all sort of Analysis.,Germany,Data Analyst
Data Analyst at Zalando was asked...,"1. first call with HR (30 mins) : questions about my background, experience and motivation 2. coding test (2 hours): SQL, python and statistical analysis 3. video call with the hiring manager (45 mins): the goal was to describe the role and see whether it would fit the expectations of the two parts. Also questions about how I approach a project in the past and different steps I decided to take and their related timing. 4. onsite interview (3 hours): the first hour was about soft-skills questions. The other 2 hours, the interview covered statistics, sql, python exercises and at the end also a case study.","What were the questions on SQL, Statistics and Python?",Germany,Data Analyst
Senior Data Analyst at Zalando was asked...,Erfahrung mit Personalverantwortung und Teamleitung?,"Hi, I'm going to have my final round interview in Zalando office where they will have some hard skills test, some mini cases. Could you please be so kind to give me some insight on what type of cases/ hard skill would be included?",Germany,Data Analyst
Product Data Analyst at N26 was asked...,Why have you applied to N26?,"Through questions like this, interviewers are mostly trying to test your skillset (and its relevance to the role) as robustly as possible, so be prepared for multiple offshoots and followups. It could be a useful exercise to do mocks with friends or colleagues in N26 to get a real sense of what the interview is actually like. Alternatively Prepfully has a ton of N26 Product Data Analyst experts who provide mock interviews for a pretty reasonable amount. prepfully.com/practice-interviews",Germany,Data Analyst
Data Analyst at trivago was asked...,"Based on this data, can you guess which country this come from?","Look for patterns in the seasonal data of bookings, look for peaks during summer vacations, narrow the country to a northern hemisphere or southern hemisphere, etc.",Germany,Data Analyst
Data Scientist at Delivery Hero was asked...,"All thing was about the my CV and Also, some Q about machine learning","It's essential to demonstrate that you can really go deep... there are plenty of followup questions and (sometimes tangential) angles to explore. There's a lot of Data Scientist experts who've worked at DeliveryHero, who provide this sort of practice through mock interviews. There's a whole list of them curated on Prepfully. prepfully.com/practice-interviews",Germany,Data Analyst
Senior Data Scientist at Delivery Hero was asked...,Some questions about my background and specialty,"It's essential to demonstrate that you can really go deep... there are plenty of followup questions and (sometimes tangential) angles to explore. There's a lot of Senior Data Scientist experts who've worked at DeliveryHero, who provide this sort of practice through mock interviews. There's a whole list of them curated on Prepfully. prepfully.com/practice-interviews",Germany,Data Analyst
Senior Data Scientist/Senior Data Engineer at FlixBus was asked...,The main portion of the interview is their HackerRank assignment. I was told I received the assignment for Data Engineers.,"I cannot reveal many details about this assignment. I recommend brushing up on some basic algorithms. Also, be familiar with developing code using Test Driven Development.",Germany,Data Analyst
Senior Data Scientist at FlixBus was asked...,Can the Scrum agile system be used for data science tasks?,"Yes, if the more researchy tasks can be split into achievable goals. Also, spikes can be used to time box tasks.",Germany,Data Analyst
Data Scientist at FlixBus was asked...,Coding question Hackerrank,Meh,Germany,Data Analyst
Data Scientist at LeanIX was asked...,"Wenn ich eine Menge vorgersagen wollte (bspw. die Anzahl verkaufter Äpfel), welchen Algorithmus könnte ich bspw. verwenden und welche Verteilung sollte ich zugrunde legen.",Gesucht war ein Generalized Linear Model mit einer Poisson Verteilung,Germany,Data Analyst
Senior Data Scientist at Outfittery was asked...,"Given the set of integers, find all the pairs that yields the specific sum.",Mostly with the movement of the fingers that depicted the propagation of indices in the array.,Germany,Data Analyst
Data Scientist at Clark (Germany) was asked...,"Depending on the stages, technical and non-technical aspects related to the role. The focus during the technical round was to ascertain how I solve. Knowing both merits and demerits of the approach would help.","No specific answer, its very subjective.",Germany,Data Analyst
Data Scientist at Airbus was asked...,"Sie lösen Sie ein Problem, wenn Sie das Problem nicht lösen können?",Ich hole mir Expertenhilfe vom Gebiet.,Germany,Data Analyst
Senior Data Analyst at MediaMarktSaturn was asked...,Present a dataset solution using Pandas Library (Python),Developing an API Architecture,Germany,Data Analyst
Data Analyst at GetYourGuide was asked...,Give me an example of great feedback you received.,Tell me about something you introduced to your current team.,Germany,Data Analyst
Data Analyst at N26 was asked...,"About my CV, interests. Why N26?","In these sorts of interviews you really need to drill down and understand what the interviewer is looking for. A good way to simulate a real interview experience is to do a mock with one of the N26 Data Analyst experts on Prepfully, rated super strongly on TrustPilot... prepfully.com/practice-interviews",Germany,Data Analyst
Data Analyst at trivago was asked...,How does trivago make money?,You will start from a formula then will get a lot of questions around the business model of trivago. Usually you discuss on the case study that you prepared.,Germany,Data Analyst
Data Analyst/Fraud Analyst at Grover was asked...,Calculate and visualize asset lifetime value given straight line depreciation method for latest Macbook. Assume cost of 1499 euro and 3 years asset lifetime. Describe other depreciation methods and their advantages/disadvantages for this specific asset type.,"It's essential to demonstrate that you can really go deep... there are plenty of followup questions and (sometimes tangential) angles to explore. There's a lot of Data Analyst/Fraud Analyst experts who've worked at Grover, who provide this sort of practice through mock interviews. There's a whole list of them curated on Prepfully. prepfully.com/practice-interviews",Germany,Data Analyst
Data Analyst at MyHammer was asked...,All about the recommendation system?,a report,Germany,Data Analyst
Data Scientist at Neoglia was asked...,How the current position is relevant to me?,The current position was related to recommender systems which is my research domain of my doctorate,Germany,Data Analyst
Data Scientist at Neoglia was asked...,What is your expected salary?,I am flexible to discuss the salary,Germany,Data Analyst
