job_company,questions,answers,country,area
Data Scientist Internship at BNP Paribas was asked...,Describe the project (in CV) and what treatment did the data have.,No answer,Portugal,Data Analyst
Data Analyst at BNP Paribas was asked...,Why did you choose bnp,No answer,Portugal,Data Analyst
Data Analyst at BOLD by Devoteam was asked...,"All questions revolved around qualifications and previous work experience, either to double-check what I listed in my resume or to make up for the lack of preparation and help fill the company's job applicant profile.",No answer,Portugal,Data Analyst
Data Scientist at Feedzai was asked...,Do a presentation about any topic.,No answer,Portugal,Data Analyst
Junior Data Scientist at Imaginary Cloud was asked...,From the second interview: What is most important? Inspiration or Hard Work?,No answer,Portugal,Data Analyst
Data Scientist at BJSS was asked...,Tell me about what models were used and how you evaluated the results in this specific project?,No answer,Portugal,Data Analyst
Data Analyst at FARFETCH was asked...,What do you know about A/B testing? What kind of BI Visualization software do you use?,No answer,Portugal,Data Analyst
Data Scientist at Aubay was asked...,Talk me about your journey,No answer,Portugal,Data Analyst
Data Analyst at SDG Group was asked...,During the skype interview I was asked to perform dome calculations in excel.,No answer,Portugal,Data Analyst
Junior Data Scientist at KWAN was asked...,They asked me about my experience in coding and other Data Science technologies.,No answer,Portugal,Data Analyst
Data Scientist at InnoWave Technologies was asked...,"My goals in life, what type of environment do you prefer to work on, your weaknesses and strengths, some technical questions related with the",No answer,Portugal,Data Analyst
Data Scientist at Axians was asked...,"I presented past projects, answered questions about them, with a lot of emphasis on the math and logic of model evaluation metrics and model's themselves.",No answer,Portugal,Data Analyst
Business Data Analyst at Adentis was asked...,What is the subject that you would like to work in and did you ever did something in that area,No answer,Portugal,Data Analyst
Business Data Analyst at Adentis was asked...,Describe yourself and your experiences,No answer,Portugal,Data Analyst
Data Scientist at BOLD by Devoteam was asked...,What is your background in Data Science ?,No answer,Portugal,Data Analyst
Business Data Scientist at Parfois was asked...,What is your best quality?,No answer,Portugal,Data Analyst
Data Scientist at Capgemini Engineering was asked...,"Technical questions: What is overfitting. This was the only question. However, this was only the first interview (the following should have more questions).",No answer,Portugal,Data Analyst
Data Analyst at Uniplaces was asked...,How well do you work with Microsoft Excel?,No answer,Portugal,Data Analyst
Data Scientist at INESC-Porto was asked...,Mostly just personal questions with no,No answer,Portugal,Data Analyst
Data Scientist at Smart Consulting was asked...,A brief introduction of myself and my path,No answer,Portugal,Data Analyst
Data Science at Casafari was asked...,How to make more data to train models when you can't collect more?,No answer,Portugal,Data Analyst
Data Scientist at closerlook was asked...,In your opinion what are the most important traits in a data scientist?,No answer,Portugal,Data Analyst
Data Scientist at Cocus was asked...,The pipeline of a machine learning project.,No answer,Portugal,Data Analyst
Data Analyst at Growin was asked...,Which technologies i used in the past,No answer,Portugal,Data Analyst
Data Scientist at Feedzai was asked...,"How would you explain precision, recall and AUC metrics of evaluation?",No answer,Portugal,Data Analyst
Data Scientist at Feedzai was asked...,How do you explain a customer what's precision and recall?,No answer,Portugal,Data Analyst
Senior Data Analyst at OLX Group was asked...,"Business case study, you can use any technology",No answer,Portugal,Data Analyst
BI Data Analyst at Miniclip was asked...,What did you find challenging about your previous job? What do you like doing in your spare time? Why do you think you would be a good fit?,No answer,Portugal,Data Analyst
Data Analyst at Miniclip was asked...,What did you find challenging about your previous job? Why do you think you are suited for this position? What do you like to do in your spare time?,No answer,Portugal,Data Analyst
Data Scientist at FARFETCH was asked...,Preguntas técnicas de programación (a escoger el lenguaje) y de conocimientos de Machine Learning.,No answer,Portugal,Data Analyst
Data Scientist at Imaginary Cloud was asked...,General data science questions Propose and programme solution to a data science task,No answer,Portugal,Data Analyst
Graduate Data Analyst at Vodafone was asked...,"Describe a situation in which you had to adapt to change quickly. Describe a situation in which you worked as a team and faced some challenges. What were your the challenges, your actions, and the outcome? The games were to assess our logic and numerical skills.",No answer,Portugal,Data Analyst
Data Scientist at Aubay was asked...,Which academic project was your favorite?,No answer,Portugal,Data Analyst
Data Scientist at Aubay was asked...,How much do you expect to receive,No answer,Portugal,Data Analyst
Data Analyst at Uniplaces was asked...,What is your professional experience?,No answer,Portugal,Data Analyst
Data Scientist at Casafari was asked...,How do you deal with missing values,No answer,Portugal,Data Analyst
Internship data Science at Smart Consulting Solutions was asked...,What kind of skills I gained in college,No answer,Portugal,Data Analyst
Data Scientist at Smart Consulting was asked...,What kind of experience did I have in similar projects,No answer,Portugal,Data Analyst
Data Scientist at Cocus was asked...,How to deploy models into production?,No answer,Portugal,Data Analyst
Business Data Analyst at Adentis was asked...,Did you ever work with ETL,No answer,Portugal,Data Analyst
Data Scientist at Feedzai was asked...,Choose a machine learning method that you are comfortable with and explain how it works.,No answer,Portugal,Data Analyst
Data Scientist at Feedzai was asked...,Describe a previous project that you worked on.,No answer,Portugal,Data Analyst
L&#39;Oreal Data Analyst Trainee at L'Oréal was asked...,"Many questions about my past experience: most of them about situations where I succeded or failed, what are my good traits and bad traits. Also one or two projects in the area. Why do I see myself working there",No answer,Portugal,Data Analyst
Data Analyst at Uniplaces was asked...,What is your availability?,No answer,Portugal,Data Analyst
Data Scientist at Casafari was asked...,Describe your workflow in a machine learning project to match duplicate ads,No answer,Portugal,Data Analyst
Data Analyst at Casafari was asked...,What are my main hard and soft skills that I could add to the team?,No answer,Portugal,Data Analyst
Data Scientist at Decskill was asked...,What do you value most in a working environment?,No answer,Portugal,Data Analyst
Data Scientist at Smart Consulting was asked...,What is the expected salary,No answer,Portugal,Data Analyst
Data Scientist at Cocus was asked...,What are feature selection mechanisms and PCA?,No answer,Portugal,Data Analyst
Data Analyst at Nestlé was asked...,Se eu já tinha experiencia com o sistema SAP,No answer,Portugal,Data Analyst
Business Data Analyst at Adentis was asked...,what is the salary you want to earn,No answer,Portugal,Data Analyst
Data Scientist at Builtrix was asked...,Questions related to your past work experience. Describe the project in detail. General conceptual questions about machine learning algorithms you know about.,No answer,Portugal,Data Analyst
Data Scientist at Feedzai was asked...,"that is quite fuzzy screening test, with necessary calculations, with short time that you have to read more than once to understand, looks like you are doing exames in school again",No answer,Portugal,Data Analyst
Data Scientist at Feedzai was asked...,Describe two of your past projects that had Machine Learning.,No answer,Portugal,Data Analyst
Data Scientist at Miniclip was asked...,- Technical questions about the challenge,No answer,Portugal,Data Analyst
Junior Data Scientist at FARFETCH was asked...,"They asked me to explain the advantages of my case-study solution to a business person, who don't know anything about to Data Science and Machine Learning.",No answer,Portugal,Data Analyst
Web Developer Junior at Prime IT was asked...,Seu eu sabia o que fazia a Prime IT,Falando o que havia lido a respeito da empresa e de seus metodos de trabalho,Portugal,Web Developer
Web Developer at Leya was asked...,"They asked all the usual job interview questions, specially regarding past professional experience, work I've done and skills I had. They also presented me with a small programming test, where I had to write on paper the general programming logic for the development of an arkanoid-like javascript game from scratch.","I wrote down the general programming logic, in the form of strutured code as required, of the game's development from scratch using oop standards.",Portugal,Web Developer
Web Developer at Landing.jobs was asked...,If I would feel Ok with unpaid extra time every day,Obviously not.,Portugal,Web Developer
Junior Web Developer at iTGROW was asked...,Difference between foreach and map Java functions,"Map returns values, foreach doesn't,...",Portugal,Web Developer
Web Developer at PDM&FC was asked...,I was asked about Java and JavaScript even though the job position was for JavaScript Web Developer,No answer,Portugal,Web Developer
Web Developer at Wiremaze was asked...,What's your salary expectation?,No answer,Portugal,Web Developer
Web Developer at Eticadata was asked...,"Database questions, CRUD",No answer,Portugal,Web Developer
Web Developer at rVisual was asked...,they asked me to fix old broken code without being able to testing it,No answer,Portugal,Web Developer
Web Developer at Wiremaze was asked...,"I was asked to do a simple HTML page, with some CSS, and then apply some Javascript algorithms to it.",No answer,Portugal,Web Developer
Web Developer at Alter Solutions was asked...,What kind of projects that you work?,No answer,Portugal,Web Developer
Web Developer at KCS IT was asked...,Area de Preferencias? Linguagens que sentes confortavel? Ingles? O que fazes nos tempos livres?,No answer,Portugal,Web Developer
Junior Web Developer at iTGROW was asked...,If I had knowlegde on design patterns and naming conventions,No answer,Portugal,Web Developer
Front End Web Developer at Movvo was asked...,Why do you want to work here,No answer,Portugal,Web Developer
Junior Web Developer at Bee Engineering was asked...,What's your Technology Stack and future preferences for a career plan?,No answer,Portugal,Web Developer
Full Stack Web Developer at Streetbees was asked...,If I really want to embrace a new challenge and why streetbees can fulfill my expectations.,No answer,Portugal,Web Developer
Full Stack Web Developer at ITSector was asked...,What are the SOLID principles?,No answer,Portugal,Web Developer
Full Stack Web Developer at ITSector was asked...,What are the 4 principles of Object Oriented Programming?,No answer,Portugal,Web Developer
Full Stack Web Developer at ITSector was asked...,"What is the difference between a left, right and inner join ?",No answer,Portugal,Web Developer
Senior Web Developer at EdirectInsure Group was asked...,Request to make a small changelle. Create a task manager using php and ajax.,No answer,Portugal,Web Developer
Full Stack Web Developer at Streetbees was asked...,If I really want to embrace a new challenge and why streetbees can fulfill my expectations.,No answer,Portugal,Web Developer
Full Stack Web Developer at ITSector was asked...,What is the difference between an interface and an abstract class?,No answer,Portugal,Web Developer
Full Stack Web Developer at ITSector was asked...,Can an abstract class be instantiated?,No answer,Portugal,Web Developer
Junior Web Developer at iTGROW was asked...,Difference between Continuous Integration and Continuous Delivery,No answer,Portugal,Web Developer
Junior Web Developer at iTGROW was asked...,Difference between PUT and POST,No answer,Portugal,Web Developer
Junior Web Developer at iTGROW was asked...,"Difference between AngularJS and Angular2, also if I had any knowlegde in React",No answer,Portugal,Web Developer
Web Developer at Sam-Sys was asked...,Where you are yourself in five years,No answer,Portugal,Web Developer
Web Developer at High Creative Studio was asked...,They asked about problem solving skills.,No answer,Portugal,Web Developer
Web Developer at Novabase was asked...,"In the first step there was some question, like binary question, that i didn't know because i haven't learn that.",No answer,Portugal,Web Developer
Web Developer at Randstad was asked...,Why had I left my previous job in another company,No answer,Portugal,Web Developer
Web Developer at ITSector was asked...,Qual é a motivação? O seu percurso.,No answer,Portugal,Web Developer
Full Stack Web Developer at ITSector was asked...,On a blank board do a simple algorithm to find a capicua.,No answer,Portugal,Web Developer
UX Designer at Sport Zone was asked...,Can you work under pressure?,Yes.,Portugal,UX/UI Designer
UX Designer at Sport Zone was asked...,Why do you want to leave you actual job?,I want a new experience.,Portugal,UX/UI Designer
UX Designer at Sport Zone was asked...,Talk about you and your experience.,I just focused on my experience.,Portugal,UX/UI Designer
UI & UX Designer at BNP Paribas was asked...,Previous experiences with data visualization,No answer,Portugal,UX/UI Designer
UX Designer at Zalando was asked...,"The interview was more about my experience, method and processes. It was not very technical.",No answer,Portugal,UX/UI Designer
UI/UX Designer at Pixelmatters was asked...,What is for you/your understading of UI/UX Design?,No answer,Portugal,UX/UI Designer
Ui\Ux Designer at YGroup Companies was asked...,"If you had to validate this solution, how would you test it?",No answer,Portugal,UX/UI Designer
UX Designer at Sport Zone was asked...,What do you expect from this job?,Be happy doing what I love to do. A fair salary. Grow as a professionnal.,Portugal,UX/UI Designer
UX Designer at Feedzai was asked...,They questioned Front-End Development instead of UX Design related ones. Also almost mocked about Design Thinking.,No answer,Portugal,UX/UI Designer
Sr UX Designer 2 at Springer Nature was asked...,"Tell me about your experience, explain your design process",No answer,Portugal,UX/UI Designer
UI/UX Designer at OutSystems was asked...,Describe the UX process you are aware of.,No answer,Portugal,UX/UI Designer
UI Designer at WIT Software was asked...,Why do you want to join us? What motivates you?,"To live and learn, to contribute and to evolve, because what motivates me to do this, my children.",Portugal,UX/UI Designer
UX-UI Designer at NDrive was asked...,- Why were i interested in working there and how could i bring value to the team,No answer,Portugal,UX/UI Designer
UI & UX Designer at BNP Paribas was asked...,Previous experiences with data visualization,No answer,Portugal,UX/UI Designer
UI/UX Designer at Pixelmatters was asked...,What is for you/your understading of UI/UX Design?,No answer,Portugal,UX/UI Designer
Ui\Ux Designer at YGroup Companies was asked...,"If you had to validate this solution, how would you test it?",No answer,Portugal,UX/UI Designer
UX-UI Designer at BOOST IT was asked...,The interview was mostly a Q&A session based on specific topics I mentioned while talking about my career path.,No answer,Portugal,UX/UI Designer
User Experience/UI Designer at Blip was asked...,"Regular questions about your method, collaboration, background and experience.",No answer,Portugal,UX/UI Designer
UI/UX Designer at OutSystems was asked...,Describe the UX process you are aware of.,No answer,Portugal,UX/UI Designer
Data Analyst at Electronic Arts was asked...,What was one of the biggest challenge on your last work? Are you more an analytical or creative person?,I answered with a challenge I had when I had to start a unit from scratch.,Spain,
Business Intelligence and Data Science Analyst at Atrapalo was asked...,How many universes did I managed,Really I have enough with mine ;),Spain,
Data Scientist at Typeform was asked...,How experienced are you with SQL?,Sounds about right -- shady company.,Spain,
Data Scientist at King was asked...,How would you implement a factorial function with no for loops?,Recursion function factorial(n) { if n = 0 return 1 else return n * factorial(n-1) },Spain,
Data Analyst/Data Scientist at Boston Consulting Group was asked...,Specific bussiness related questions to a case problem about airlines competition between companies.,Calculations. You only have 1:30 seconds per question and I answered less than half of the questions,Spain,
Junior Data Analyst at Criteo was asked...,How many mattresses have been sold in UK over the past year?,I calculated,Spain,
"Data Analyst, Business Analyst at Criteo was asked...",Guessitmation Question--- How many mattress are sold in the UK each year?,No answer,Spain,
Data Analyst at Accenture was asked...,Where do you see yourself in 5 years,No answer,Spain,
"Consultant, Data Analyst at SDG Group was asked...",Que te ha hecho apuntarte en esta oferta?,por mi futuro laboral,Spain,
Senior Data Analyst at McKinsey & Company was asked...,There was an unexpected math test after the PST which was difficult for someone who has not done permutations and whatnot in a while.,Still waiting for first round.,Spain,
HR Reward & Data Analyst at TravelPerk was asked...,"Sounds that you are happy in your current company, why do you really want to join TK?",,Spain,
Data Analyst at Glovo was asked...,Puedes explicar el código que escribiste?,Sustentar lo que se hizo.,Spain,
Data Scientist at Accenture was asked...,What is your familiarity with statistical methods and passed projects ?,"Naming some previous work, studies and methods I used in my work. Bayesian networks, Some example of optimization problems.",Spain,
Intern data scientist at ExoClick was asked...,"Analyse a dataset of views per ad_type, and predict the eCPM for the next days.",Use time series analysis.,Spain,
Data Analyst at Amazon was asked...,1)What do you do when a customer is not satisfied with a company product? ( I would be very happy if somebody tells me the relationship between the position title and the question) 2) What is the KNN in the machine learning? (Very funny) 3) Do you help other employees if needed?,"They are testing you on their first principle, which is ""Customer Obsession"". It's about how much value you give to the customer experience, the end customer can also be a client here.",Spain,
Data Scientist at Trovit was asked...,How do you think your skills are useful to the position?,"I come from a research institution and the position, although slightly different from my background, was a applied research position. Personally, I think the skills I gained during my Ph.D. and postdoc completely suit the demands of the company since it is a job I have done already.",Spain,
Data Analyst at Center for Genomic Regulation was asked...,"There was some question for doing something on computer, but they didn't give me a prepared one for that, I had to use my own laptop, most time spent on download necessary stuff, didn't finish the task.","Except the one where I had to use my laptop, all answered ARAIR.",Spain,
Data Scientist at EY was asked...,¿Como consideras tu nivel de inglés?,Nivel intermedio,Spain,
Game Data Scientist/Analyst at Socialpoint was asked...,Why am I interested in this role at this company? They wanted to make sure I was passionate about the industry.,"With sincerity. I love video games and data science, so the position and company were great fits.",Spain,
Senior Data Scientist at Glovo was asked...,How would you evaluate a forecast,"depending on the forecasting: Mainly there are 2 kinds (there are more) of forecasting, a numerical( a real number) or categorical (True/False). * for numerical forecasting the most usual metric is RMSE [Root Mean Square Error] * for categorical the most common one is AUC-ROC or AUC [Area Under the Curve of Recovery Operating Characteristic]",Spain,
Senior Data Scientist at Glovo was asked...,How would you evaluate a forecast,,Spain,
Senior Data Scientist at NTT Ltd. was asked...,"As I said before solve problems of nested list, pointers in C++, bayesian and deep learning and its mathematical details.","Text books answers, that usually are not used in real life problems. But they ask a lot details in the mathematical approach, equations (write them in a white board)",Spain,
Data Analyst at YGroup Companies was asked...,"Cuantos gramos de jamon serrano se cosumieron en España el 24 de diciembre ? Una marca de bolsos vende en todo España y quiere crecer en su venta online, como le hace?",No answer,Spain,
Data Scientist at Endesa S.A. was asked...,"Preguntas del tipo que has estudiado, por que te interesa la compañia, que conoces de la compañia...",No answer,Spain,
Data Analyst at YGroup was asked...,Experiencia previa como consultor. Adaptacion de mis proyectos a la realidad de la pandemia,No answer,Spain,
Junior Data Analyst at 360 Talent Acquisition was asked...,No llegué a avanzar la entrevista. Muy maleducados.,No answer,Spain,
Data Science at S2 Grupo was asked...,"Deep knowledge of fundamentals of machine learning, data mining and statistical predictive modeling, and extensive experience applying these methods to real world problems Strong skills in software prototyping and engineering with expertise in applicable programming and analytics languages (Python, R, C/C++) and various open source machine learning and analytics packages to generate deliverable modules and prototype demonstrations of their work Desired interdisciplinary skills include big data technologies, ETL, statistics and causal inference, Deep Learning, modeling and simulation Breadth of skills and experience in machine learning diverse types of data, diverse data sources, dfferent types of learning models, diverse learning settings Ability and inclination to work in multi-disciplinary environments, and desire to see ideas realized in practice Experience and knowledge in services domains such as business process outsourcing systems, transportation systems, healthcare systems and financial services is valued Demonstrated ability to propose novel solutions to problems, performing experiments to show feasibility of their solutions and working to refine the solutions into a real-world context Strong analytical, written, and verbal communication skills",No answer,Spain,
Data Scientist at McKinsey & Company was asked...,"Sobre experiencias pasadas, relacionadas con trabajos anteriores.",No answer,Spain,
Data Scientist at McKinsey & Company was asked...,"Short programming questions. Multiple choice, reoder code, complete code, etc.",No answer,Spain,
Data Scientist at McKinsey & Company was asked...,"Preguntas generales en la entrevista telefonica y preguntas técnicas matematicas, estadistica, programacion en python en hackerrank",No answer,Spain,
Data Analyst at Basebone was asked...,Are you a BDA? Would you administer Cassandra? What is the most difficult part of data analysis?,No answer,Spain,
Data Analyst at Basebone was asked...,Do you mind to work in a fast changing environment?,No answer,Spain,
Data Scientist at Cabify was asked...,Design an A/B test for a real scenario.,No answer,Spain,
Data Scientist at Cabify was asked...,Describe the last project you were involved in.,No answer,Spain,
Data Scientist at ExoClick was asked...,They gave me a simple dataset and a recipe to do something,No answer,Spain,
Data Scientist at Typeform was asked...,Two typical questions to check coding skills involving logic implementation to solve a problem with lists/strings etc,No answer,Spain,
Data Analyst at Atmira was asked...,¿Hasta donde dominas de Qlik? ¿Qué conoces de la herramienta?,No answer,Spain,
Data Analyst at Apple was asked...,- How do you keep motivated when you are doing a repetitive task? - What do you think about AI? - What do you do when you join a new team?,No answer,Spain,
Data Scientist at King was asked...,Which coding practices make a good code?,No answer,Spain,
Data Science Intern at King was asked...,How would the distribution of Candy Crush players over the levels of the game look like?,No answer,Spain,
Data Scientist at King was asked...,All questions I got have already been posted.,No answer,Spain,
Data Scientist at King was asked...,Which coding practices make a good code?,No answer,Spain,
Data Science Intern at King was asked...,How would the distribution of Candy Crush players over the levels of the game look like?,No answer,Spain,
Data Analyst at Returnly was asked...,"- Test on Stats and SQL - An assignment was given , it had the data for a particular merchant, you have to analyse their data and finally make a presentation to convince the merchant by making him see the value added by returnly to his business",No answer,Spain,
Data Analyst at Qustodio was asked...,How does a Random Forest make each tree unique,No answer,Spain,
Data Analyst at Preply was asked...,How do you solve problems?,No answer,Spain,
Game Data Analyst at Socialpoint was asked...,What metrics would you use to measure user enjoyment of a new feature?,No answer,Spain,
Data Scientist at Socialpoint was asked...,Given some databases write a query to extract some data in SQL.,No answer,Spain,
Junior Data Scientist at Glovo was asked...,Cómo estimarías el tiempo de elaboración de un pedido y qué proceso seguirías para automatizarlo.,No answer,Spain,
